<?xml encoding='US-ASCII'?>

<!ELEMENT SSAPVersion (property*)>

<!ELEMENT property (#PCDATA)>
<!ATTLIST property name    CDATA   #REQUIRED>
<!ATTLIST property value   CDATA   #REQUIRED>
